{
  "softwareRepoDefinitionVersion": "1.0.0",
  "repoName": "OpenCode",
  "repoDescription": "OpenCode software repository",
  "repoSoftware": [
    {
      "id": "opencode-cli",
      "name": "OpenCode CLI",
      "developerName": "Anomaly Innovations Inc.",
      "description": "Interactive agentic LLM-CLI tool",
      "sourceUrl": "https://github.com/anomalyco/opencode",
      "optionalLatestReleaseVersion": "v1.18.15",
      "releases": [
        {
          "version": "v1.4.9",
          "releaseTimestamp": "2026-04-17T16:20:14Z",
          "downloads": {
            "windows": {
              "x86-64": "https://github.com/anomalyco/opencode/releases/download/v1.4.9/opencode-windows-x64.zip",
              "arm64": "https://github.com/anomalyco/opencode/releases/download/v1.4.9/opencode-windows-arm64.zip"
            },
            "macos": {
              "x86-64": "https://github.com/anomalyco/opencode/releases/download/v1.4.9/opencode-darwin-x64.zip",
              "arm64": "https://github.com/anomalyco/opencode/releases/download/v1.4.9/opencode-darwin-arm64.zip"
            },
            "unix": {
              "x86-64": "https://github.com/anomalyco/opencode/releases/download/v1.4.9/opencode-linux-x64.tar.gz",
              "arm64": "https://github.com/anomalyco/opencode/releases/download/v1.4.9/opencode-linux-arm64.tar.gz"
            }
          }
        },
        {
          "version": "v1.4.10",
          "releaseTimestamp": "2026-04-17T20:13:50Z",
          "downloads": {
            "windows": {
              "x86-64": "https://github.com/anomalyco/opencode/releases/download/v1.4.10/opencode-windows-x64.zip",
              "arm64": "https://github.com/anomalyco/opencode/releases/download/v1.4.10/opencode-windows-arm64.zip"
            },
            "macos": {
              "x86-64": "https://github.com/anomalyco/opencode/releases/download/v1.4.10/opencode-darwin-x64.zip",
              "arm64": "https://github.com/anomalyco/opencode/releases/download/v1.4.10/opencode-darwin-arm64.zip"
            },
            "unix": {
              "x86-64": "https://github.com/anomalyco/opencode/releases/download/v1.4.10/opencode-linux-x64.tar.gz",
              "arm64": "https://github.com/anomalyco/opencode/releases/download/v1.4.10/opencode-linux-arm64.tar.gz"
            }
          }
        },
        {
          "version": "v1.4.11",
          "releaseTimestamp": "2026-04-18T00:29:42Z",
          "downloads": {
            "windows": {
              "x86-64": "https://github.com/anomalyco/opencode/releases/download/v1.4.11/opencode-windows-x64.zip",
              "arm64": "https://github.com/anomalyco/opencode/releases/download/v1.4.11/opencode-windows-arm64.zip"
            },
            "macos": {
              "x86-64": "https://github.com/anomalyco/opencode/releases/download/v1.4.11/opencode-darwin-x64.zip",
              "arm64": "https://github.com/anomalyco/opencode/releases/download/v1.4.11/opencode-darwin-arm64.zip"
            },
            "unix": {
              "x86-64": "https://github.com/anomalyco/opencode/releases/download/v1.4.11/opencode-linux-x64.tar.gz",
              "arm64": "https://github.com/anomalyco/opencode/releases/download/v1.4.11/opencode-linux-arm64.tar.gz"
            }
          }
        },
        {
          "version": "v1.14.17",
          "releaseTimestamp": "2026-04-19T03:02:16Z",
          "downloads": {
            "windows": {
              "x86-64": "https://github.com/anomalyco/opencode/releases/download/v1.14.17/opencode-windows-x64.zip",
              "arm64": "https://github.com/anomalyco/opencode/releases/download/v1.14.17/opencode-windows-arm64.zip"
            },
            "macos": {
              "x86-64": "https://github.com/anomalyco/opencode/releases/download/v1.14.17/opencode-darwin-x64.zip",
              "arm64": "https://github.com/anomalyco/opencode/releases/download/v1.14.17/opencode-darwin-arm64.zip"
            },
            "unix": {
              "x86-64": "https://github.com/anomalyco/opencode/releases/download/v1.14.17/opencode-linux-x64.tar.gz",
              "arm64": "https://github.com/anomalyco/opencode/releases/download/v1.14.17/opencode-linux-arm64.tar.gz"
            }
          }
        },
        {
          "version": "v1.14.18",
          "releaseTimestamp": "2026-04-19T09:36:58Z",
          "downloads": {
            "windows": {
              "x86-64": "https://github.com/anomalyco/opencode/releases/download/v1.14.18/opencode-windows-x64.zip",
              "arm64": "https://github.com/anomalyco/opencode/releases/download/v1.14.18/opencode-windows-arm64.zip"
            },
            "macos": {
              "x86-64": "https://github.com/anomalyco/opencode/releases/download/v1.14.18/opencode-darwin-x64.zip",
              "arm64": "https://github.com/anomalyco/opencode/releases/download/v1.14.18/opencode-darwin-arm64.zip"
            },
            "unix": {
              "x86-64": "https://github.com/anomalyco/opencode/releases/download/v1.14.18/opencode-linux-x64.tar.gz",
              "arm64": "https://github.com/anomalyco/opencode/releases/download/v1.14.18/opencode-linux-arm64.tar.gz"
            }
          }
        },
        {
          "version": "v1.14.19",
          "releaseTimestamp": "2026-04-20T07:21:48Z",
          "downloads": {
            "windows": {
              "x86-64": "https://github.com/anomalyco/opencode/releases/download/v1.14.19/opencode-windows-x64.zip",
              "arm64": "https://github.com/anomalyco/opencode/releases/download/v1.14.19/opencode-windows-arm64.zip"
            },
            "macos": {
              "x86-64": "https://github.com/anomalyco/opencode/releases/download/v1.14.19/opencode-darwin-x64.zip",
              "arm64": "https://github.com/anomalyco/opencode/releases/download/v1.14.19/opencode-darwin-arm64.zip"
            },
            "unix": {
              "x86-64": "https://github.com/anomalyco/opencode/releases/download/v1.14.19/opencode-linux-x64.tar.gz",
              "arm64": "https://github.com/anomalyco/opencode/releases/download/v1.14.19/opencode-linux-arm64.tar.gz"
            }
          }
        },
        {
          "version": "v1.14.20",
          "releaseTimestamp": "2026-04-21T19:07:38Z",
          "downloads": {
            "windows": {
              "x86-64": "https://github.com/anomalyco/opencode/releases/download/v1.14.20/opencode-windows-x64.zip",
              "arm64": "https://github.com/anomalyco/opencode/releases/download/v1.14.20/opencode-windows-arm64.zip"
            },
            "macos": {
              "x86-64": "https://github.com/anomalyco/opencode/releases/download/v1.14.20/opencode-darwin-x64.zip",
              "arm64": "https://github.com/anomalyco/opencode/releases/download/v1.14.20/opencode-darwin-arm64.zip"
            },
            "unix": {
              "x86-64": "https://github.com/anomalyco/opencode/releases/download/v1.14.20/opencode-linux-x64.tar.gz",
              "arm64": "https://github.com/anomalyco/opencode/releases/download/v1.14.20/opencode-linux-arm64.tar.gz"
            }
          }
        },
        {
          "version": "v1.14.21",
          "releaseTimestamp": "2026-04-23T05:45:23Z",
          "downloads": {
            "windows": {
              "x86-64": "https://github.com/anomalyco/opencode/releases/download/v1.14.21/opencode-windows-x64.zip",
              "arm64": "https://github.com/anomalyco/opencode/releases/download/v1.14.21/opencode-windows-arm64.zip"
            },
            "macos": {
              "x86-64": "https://github.com/anomalyco/opencode/releases/download/v1.14.21/opencode-darwin-x64.zip",
              "arm64": "https://github.com/anomalyco/opencode/releases/download/v1.14.21/opencode-darwin-arm64.zip"
            },
            "unix": {
              "x86-64": "https://github.com/anomalyco/opencode/releases/download/v1.14.21/opencode-linux-x64.tar.gz",
              "arm64": "https://github.com/anomalyco/opencode/releases/download/v1.14.21/opencode-linux-arm64.tar.gz"
            }
          }
        },
        {
          "version": "v1.14.22",
          "releaseTimestamp": "2026-04-23T15:56:51Z",
          "downloads": {
            "windows": {
              "x86-64": "https://github.com/anomalyco/opencode/releases/download/v1.14.22/opencode-windows-x64.zip",
              "arm64": "https://github.com/anomalyco/opencode/releases/download/v1.14.22/opencode-windows-arm64.zip"
            },
            "macos": {
              "x86-64": "https://github.com/anomalyco/opencode/releases/download/v1.14.22/opencode-darwin-x64.zip",
              "arm64": "https://github.com/anomalyco/opencode/releases/download/v1.14.22/opencode-darwin-arm64.zip"
            },
            "unix": {
              "x86-64": "https://github.com/anomalyco/opencode/releases/download/v1.14.22/opencode-linux-x64.tar.gz",
              "arm64": "https://github.com/anomalyco/opencode/releases/download/v1.14.22/opencode-linux-arm64.tar.gz"
            }
          }
        },
        {
          "version": "v1.14.23",
          "releaseTimestamp": "2026-04-24T13:17:15Z",
          "downloads": {
            "windows": {
              "x86-64": "https://github.com/anomalyco/opencode/releases/download/v1.14.23/opencode-windows-x64.zip",
              "arm64": "https://github.com/anomalyco/opencode/releases/download/v1.14.23/opencode-windows-arm64.zip"
            },
            "macos": {
              "x86-64": "https://github.com/anomalyco/opencode/releases/download/v1.14.23/opencode-darwin-x64.zip",
              "arm64": "https://github.com/anomalyco/opencode/releases/download/v1.14.23/opencode-darwin-arm64.zip"
            },
            "unix": {
              "x86-64": "https://github.com/anomalyco/opencode/releases/download/v1.14.23/opencode-linux-x64.tar.gz",
              "arm64": "https://github.com/anomalyco/opencode/releases/download/v1.14.23/opencode-linux-arm64.tar.gz"